2024-06-03 23:31:06 - Configuración actualizada.
2024-06-03 23:31:06 - Error al configurar ajustes: 'Frame' object has no attribute 'intrusion_count'
2024-06-03 23:31:16 - Iniciando captura de paquetes...
2024-06-03 23:31:32 - Se detectó escaneo de puertos desde 192.168.100.7 | Packet Info: Ether / IP / TCP 192.168.100.7:56206 > 20.198.2.181:https PA / Raw
2024-06-03 23:31:32 - Error analizando paquete: 'Frame' object has no attribute 'intrusion_count'
2024-06-03 23:31:32 - Error al capturar paquetes: 'Frame' object has no attribute 'intrusion_count'
2024-06-03 23:32:13 - Deteniendo captura de paquetes.
2024-06-03 23:37:01 - Configuración actualizada.
2024-06-03 23:37:06 - Iniciando captura de paquetes...
2024-06-03 23:37:15 - Se detectó escaneo de puertos desde 192.168.100.7 | Packet Info: Ether / IP / TCP 192.168.100.7:49768 > 35.186.224.36:https PA / Raw
2024-06-03 23:37:15 - Se detectó escaneo de puertos desde 192.168.100.7 | Packet Info: Ether / IP / TCP 192.168.100.7:49768 > 35.186.224.36:https A
2024-06-03 23:37:21 - Se detectó escaneo de puertos desde 192.168.100.7 | Packet Info: Ether / IP / TCP 192.168.100.7:56285 > 52.178.17.234:https A
2024-06-03 23:37:21 - Se detectó escaneo de puertos desde 192.168.100.7 | Packet Info: Ether / IP / TCP 192.168.100.7:56285 > 52.178.17.234:https PA / Raw
2024-06-03 23:37:21 - Se detectó escaneo de puertos desde 192.168.100.7 | Packet Info: Ether / IP / TCP 192.168.100.7:56285 > 52.178.17.234:https PA / Raw
2024-06-03 23:37:21 - Se detectó escaneo de puertos desde 192.168.100.7 | Packet Info: Ether / IP / TCP 192.168.100.7:56285 > 52.178.17.234:https A
2024-06-03 23:37:21 - Se detectó escaneo de puertos desde 192.168.100.7 | Packet Info: Ether / IP / TCP 192.168.100.7:56285 > 52.178.17.234:https A
2024-06-03 23:37:21 - Se detectó escaneo de puertos desde 192.168.100.7 | Packet Info: Ether / IP / TCP 192.168.100.7:56285 > 52.178.17.234:https PA / Raw
2024-06-03 23:37:21 - Se detectó escaneo de puertos desde 192.168.100.7 | Packet Info: Ether / IP / TCP 192.168.100.7:56285 > 52.178.17.234:https A
2024-06-03 23:37:21 - Se detectó escaneo de puertos desde 192.168.100.7 | Packet Info: Ether / IP / TCP 192.168.100.7:56285 > 52.178.17.234:https PA / Raw
2024-06-03 23:37:21 - Se detectó escaneo de puertos desde 192.168.100.7 | Packet Info: Ether / IP / TCP 192.168.100.7:56285 > 52.178.17.234:https FA
2024-06-03 23:37:22 - Se detectó escaneo de puertos desde 192.168.100.7 | Packet Info: Ether / IP / TCP 192.168.100.7:49677 > 207.188.7.33:https A / Raw
2024-06-03 23:37:22 - Se detectó escaneo de puertos desde 192.168.100.7 | Packet Info: Ether / IP / TCP 192.168.100.7:56231 > 20.189.173.6:https PA / Raw
2024-06-03 23:37:22 - Se detectó escaneo de puertos desde 192.168.100.7 | Packet Info: Ether / IP / TCP 192.168.100.7:56231 > 20.189.173.6:https PA / Raw
2024-06-03 23:37:22 - Se detectó escaneo de puertos desde 192.168.100.7 | Packet Info: Ether / IP / TCP 192.168.100.7:56231 > 20.189.173.6:https PA / Raw
2024-06-03 23:37:23 - Se detectó escaneo de puertos desde 192.168.100.7 | Packet Info: Ether / IP / TCP 192.168.100.7:56286 > 52.178.17.234:https S
2024-06-03 23:37:23 - Se detectó escaneo de puertos desde 192.168.100.7 | Packet Info: Ether / IP / TCP 192.168.100.7:56231 > 20.189.173.6:https A
2024-06-03 23:37:23 - Se detectó escaneo de puertos desde 52.178.17.234 | Packet Info: Ether / IP / TCP 52.178.17.234:https > 192.168.100.7:56286 SA
2024-06-03 23:37:23 - Se detectó escaneo de puertos desde 192.168.100.7 | Packet Info: Ether / IP / TCP 192.168.100.7:56286 > 52.178.17.234:https A
2024-06-03 23:37:23 - Se detectó escaneo de puertos desde 192.168.100.7 | Packet Info: Ether / IP / TCP 192.168.100.7:56286 > 52.178.17.234:https PA / Raw
2024-06-03 23:37:23 - Se detectó escaneo de puertos desde 192.168.100.7 | Packet Info: Ether / IP / TCP 192.168.100.7:56231 > 20.189.173.6:https PA / Raw
2024-06-03 23:37:23 - Se detectó escaneo de puertos desde 20.189.173.6 | Packet Info: Ether / IP / TCP 20.189.173.6:https > 192.168.100.7:56231 A / Padding
2024-06-03 23:37:23 - Se detectó escaneo de puertos desde 52.178.17.234 | Packet Info: Ether / IP / TCP 52.178.17.234:https > 192.168.100.7:56286 PA / Raw
2024-06-03 23:37:23 - Se detectó escaneo de puertos desde 192.168.100.7 | Packet Info: Ether / IP / TCP 192.168.100.7:56286 > 52.178.17.234:https PA / Raw
2024-06-03 23:37:23 - Se detectó escaneo de puertos desde 52.178.17.234 | Packet Info: Ether / IP / TCP 52.178.17.234:https > 192.168.100.7:56286 A / Raw
2024-06-03 23:37:23 - Se detectó escaneo de puertos desde 52.178.17.234 | Packet Info: Ether / IP / TCP 52.178.17.234:https > 192.168.100.7:56286 A / Raw
2024-06-03 23:37:23 - Se detectó escaneo de puertos desde 192.168.100.7 | Packet Info: Ether / IP / TCP 192.168.100.7:56286 > 52.178.17.234:https A
2024-06-03 23:37:23 - Se detectó escaneo de puertos desde 52.178.17.234 | Packet Info: Ether / IP / TCP 52.178.17.234:https > 192.168.100.7:56286 A / Raw
2024-06-03 23:37:23 - Se detectó escaneo de puertos desde 52.178.17.234 | Packet Info: Ether / IP / TCP 52.178.17.234:https > 192.168.100.7:56286 PA / Raw
2024-06-03 23:37:23 - Se detectó escaneo de puertos desde 192.168.100.7 | Packet Info: Ether / IP / TCP 192.168.100.7:56286 > 52.178.17.234:https A
2024-06-03 23:37:23 - Se detectó escaneo de puertos desde 192.168.100.7 | Packet Info: Ether / IP / TCP 192.168.100.7:56286 > 52.178.17.234:https PA / Raw
2024-06-03 23:37:23 - Se detectó escaneo de puertos desde 52.178.17.234 | Packet Info: Ether / IP / TCP 52.178.17.234:https > 192.168.100.7:56286 A / Padding
2024-06-03 23:37:23 - Se detectó escaneo de puertos desde 52.178.17.234 | Packet Info: Ether / IP / TCP 52.178.17.234:https > 192.168.100.7:56286 PA / Raw
2024-06-03 23:37:23 - Se detectó escaneo de puertos desde 52.178.17.234 | Packet Info: Ether / IP / TCP 52.178.17.234:https > 192.168.100.7:56286 FPA / Raw
2024-06-03 23:37:23 - Se detectó escaneo de puertos desde 192.168.100.7 | Packet Info: Ether / IP / TCP 192.168.100.7:56286 > 52.178.17.234:https A
2024-06-03 23:37:23 - Se detectó escaneo de puertos desde 192.168.100.7 | Packet Info: Ether / IP / TCP 192.168.100.7:56286 > 52.178.17.234:https PA / Raw
2024-06-03 23:37:23 - Se detectó escaneo de puertos desde 192.168.100.7 | Packet Info: Ether / IP / TCP 192.168.100.7:56286 > 52.178.17.234:https FA
2024-06-03 23:37:23 - Se detectó escaneo de puertos desde 52.178.17.234 | Packet Info: Ether / IP / TCP 52.178.17.234:https > 192.168.100.7:56286 A / Padding
2024-06-03 23:37:23 - Se detectó escaneo de puertos desde 192.168.100.7 | Packet Info: Ether / IP / TCP 192.168.100.7:56228 > 152.199.4.33:https A / Raw
2024-06-03 23:37:24 - Se detectó escaneo de puertos desde 192.168.100.7 | Packet Info: Ether / IP / TCP 192.168.100.7:55829 > 162.159.136.234:https PA / Raw
2024-06-03 23:37:24 - Se detectó escaneo de puertos desde 192.168.100.7 | Packet Info: Ether / IP / TCP 192.168.100.7:55829 > 162.159.136.234:https A
2024-06-03 23:37:24 - Se detectó escaneo de puertos desde 192.168.100.7 | Packet Info: Ether / IP / TCP 192.168.100.7:56124 > 3.161.4.91:https A / Raw
2024-06-03 23:37:26 - Se detectó escaneo de puertos desde 192.168.100.7 | Packet Info: Ether / IP / TCP 192.168.100.7:55829 > 162.159.136.234:https A
2024-06-03 23:37:27 - Se detectó escaneo de puertos desde 192.168.100.7 | Packet Info: Ether / IP / TCP 192.168.100.7:54858 > 20.127.250.238:https A / Raw
2024-06-03 23:37:28 - Se detectó escaneo de puertos desde 192.168.100.7 | Packet Info: Ether / IP / TCP 192.168.100.7:56287 > 52.178.17.234:https S
2024-06-03 23:37:28 - Se detectó escaneo de puertos desde 52.178.17.234 | Packet Info: Ether / IP / TCP 52.178.17.234:https > 192.168.100.7:56287 SA
2024-06-03 23:37:28 - Se detectó escaneo de puertos desde 192.168.100.7 | Packet Info: Ether / IP / TCP 192.168.100.7:56287 > 52.178.17.234:https A
2024-06-03 23:37:28 - Se detectó escaneo de puertos desde 192.168.100.7 | Packet Info: Ether / IP / TCP 192.168.100.7:56287 > 52.178.17.234:https PA / Raw
2024-06-03 23:37:28 - Se detectó escaneo de puertos desde 52.178.17.234 | Packet Info: Ether / IP / TCP 52.178.17.234:https > 192.168.100.7:56287 PA / Raw
2024-06-03 23:37:28 - Se detectó escaneo de puertos desde 192.168.100.7 | Packet Info: Ether / IP / TCP 192.168.100.7:56287 > 52.178.17.234:https PA / Raw
2024-06-03 23:37:28 - Se detectó escaneo de puertos desde 52.178.17.234 | Packet Info: Ether / IP / TCP 52.178.17.234:https > 192.168.100.7:56287 A / Raw
2024-06-03 23:37:28 - Se detectó escaneo de puertos desde 52.178.17.234 | Packet Info: Ether / IP / TCP 52.178.17.234:https > 192.168.100.7:56287 A / Raw
2024-06-03 23:37:28 - Se detectó escaneo de puertos desde 192.168.100.7 | Packet Info: Ether / IP / TCP 192.168.100.7:56287 > 52.178.17.234:https A
2024-06-03 23:37:28 - Se detectó escaneo de puertos desde 52.178.17.234 | Packet Info: Ether / IP / TCP 52.178.17.234:https > 192.168.100.7:56287 A / Raw
2024-06-03 23:37:28 - Se detectó escaneo de puertos desde 52.178.17.234 | Packet Info: Ether / IP / TCP 52.178.17.234:https > 192.168.100.7:56287 PA / Raw
2024-06-03 23:37:28 - Se detectó escaneo de puertos desde 192.168.100.7 | Packet Info: Ether / IP / TCP 192.168.100.7:56287 > 52.178.17.234:https A
2024-06-03 23:37:28 - Se detectó escaneo de puertos desde 192.168.100.7 | Packet Info: Ether / IP / TCP 192.168.100.7:56287 > 52.178.17.234:https PA / Raw
2024-06-03 23:37:28 - Se detectó escaneo de puertos desde 52.178.17.234 | Packet Info: Ether / IP / TCP 52.178.17.234:https > 192.168.100.7:56287 A / Padding
2024-06-03 23:37:28 - Se detectó escaneo de puertos desde 52.178.17.234 | Packet Info: Ether / IP / TCP 52.178.17.234:https > 192.168.100.7:56287 PA / Raw
2024-06-03 23:37:28 - Se detectó escaneo de puertos desde 52.178.17.234 | Packet Info: Ether / IP / TCP 52.178.17.234:https > 192.168.100.7:56287 FPA / Raw
2024-06-03 23:37:28 - Se detectó escaneo de puertos desde 192.168.100.7 | Packet Info: Ether / IP / TCP 192.168.100.7:56287 > 52.178.17.234:https A
2024-06-03 23:37:28 - Se detectó escaneo de puertos desde 192.168.100.7 | Packet Info: Ether / IP / TCP 192.168.100.7:56287 > 52.178.17.234:https PA / Raw
2024-06-03 23:37:28 - Se detectó escaneo de puertos desde 192.168.100.7 | Packet Info: Ether / IP / TCP 192.168.100.7:56287 > 52.178.17.234:https FA
2024-06-03 23:37:28 - Se detectó escaneo de puertos desde 192.168.100.7 | Packet Info: Ether / IP / TCP 192.168.100.7:55829 > 162.159.136.234:https A
2024-06-03 23:37:28 - Se detectó escaneo de puertos desde 52.178.17.234 | Packet Info: Ether / IP / TCP 52.178.17.234:https > 192.168.100.7:56287 A / Padding
2024-06-03 23:37:32 - Se detectó escaneo de puertos desde 192.168.100.7 | Packet Info: Ether / IP / TCP 192.168.100.7:55829 > 162.159.136.234:https A
2024-06-03 23:37:32 - Se detectó escaneo de puertos desde 192.168.100.7 | Packet Info: Ether / IP / TCP 192.168.100.7:49677 > 207.188.7.33:https A / Raw
2024-06-03 23:37:32 - Se detectó escaneo de puertos desde 192.168.100.7 | Packet Info: Ether / IP / TCP 192.168.100.7:49677 > 207.188.7.33:https A
2024-06-03 23:37:34 - Se detectó escaneo de puertos desde 192.168.100.7 | Packet Info: Ether / IP / TCP 192.168.100.7:56288 > 52.178.17.234:https S
2024-06-03 23:37:34 - Se detectó escaneo de puertos desde 52.178.17.234 | Packet Info: Ether / IP / TCP 52.178.17.234:https > 192.168.100.7:56288 SA
2024-06-03 23:37:34 - Se detectó escaneo de puertos desde 192.168.100.7 | Packet Info: Ether / IP / TCP 192.168.100.7:56288 > 52.178.17.234:https A
2024-06-03 23:37:34 - Se detectó escaneo de puertos desde 192.168.100.7 | Packet Info: Ether / IP / TCP 192.168.100.7:56288 > 52.178.17.234:https PA / Raw
2024-06-03 23:37:34 - Se detectó escaneo de puertos desde 52.178.17.234 | Packet Info: Ether / IP / TCP 52.178.17.234:https > 192.168.100.7:56288 PA / Raw
2024-06-03 23:37:34 - Se detectó escaneo de puertos desde 192.168.100.7 | Packet Info: Ether / IP / TCP 192.168.100.7:56288 > 52.178.17.234:https PA / Raw
2024-06-03 23:37:35 - Se detectó escaneo de puertos desde 192.168.100.7 | Packet Info: Ether / IP / TCP 192.168.100.7:54953 > 20.125.23.3:https A
2024-06-03 23:37:35 - Se detectó escaneo de puertos desde 52.178.17.234 | Packet Info: Ether / IP / TCP 52.178.17.234:https > 192.168.100.7:56288 A / Raw
2024-06-03 23:37:35 - Se detectó escaneo de puertos desde 52.178.17.234 | Packet Info: Ether / IP / TCP 52.178.17.234:https > 192.168.100.7:56288 A / Raw
2024-06-03 23:37:35 - Se detectó escaneo de puertos desde 52.178.17.234 | Packet Info: Ether / IP / TCP 52.178.17.234:https > 192.168.100.7:56288 A / Raw
2024-06-03 23:37:35 - Se detectó escaneo de puertos desde 52.178.17.234 | Packet Info: Ether / IP / TCP 52.178.17.234:https > 192.168.100.7:56288 PA / Raw
2024-06-03 23:37:35 - Se detectó escaneo de puertos desde 192.168.100.7 | Packet Info: Ether / IP / TCP 192.168.100.7:56288 > 52.178.17.234:https A
2024-06-03 23:37:35 - Se detectó escaneo de puertos desde 192.168.100.7 | Packet Info: Ether / IP / TCP 192.168.100.7:56288 > 52.178.17.234:https PA / Raw
2024-06-03 23:37:35 - Se detectó escaneo de puertos desde 192.168.100.7 | Packet Info: Ether / IP / TCP 192.168.100.7:56289 > 52.20.22.182:https S
2024-06-03 23:37:35 - Se detectó escaneo de puertos desde 192.168.100.7 | Packet Info: Ether / IP / TCP 192.168.100.7:56289 > 52.20.22.182:https A
2024-06-03 23:37:35 - Se detectó escaneo de puertos desde 192.168.100.7 | Packet Info: Ether / IP / TCP 192.168.100.7:56289 > 52.20.22.182:https PA / Raw
2024-06-03 23:37:35 - Se detectó escaneo de puertos desde 52.178.17.234 | Packet Info: Ether / IP / TCP 52.178.17.234:https > 192.168.100.7:56288 A / Padding
2024-06-03 23:37:35 - Se detectó escaneo de puertos desde 52.178.17.234 | Packet Info: Ether / IP / TCP 52.178.17.234:https > 192.168.100.7:56288 PA / Raw
2024-06-03 23:37:35 - Se detectó escaneo de puertos desde 52.178.17.234 | Packet Info: Ether / IP / TCP 52.178.17.234:https > 192.168.100.7:56288 FPA / Raw
2024-06-03 23:37:35 - Se detectó escaneo de puertos desde 192.168.100.7 | Packet Info: Ether / IP / TCP 192.168.100.7:56288 > 52.178.17.234:https A
2024-06-03 23:37:35 - Se detectó escaneo de puertos desde 192.168.100.7 | Packet Info: Ether / IP / TCP 192.168.100.7:56288 > 52.178.17.234:https PA / Raw
2024-06-03 23:37:35 - Se detectó escaneo de puertos desde 192.168.100.7 | Packet Info: Ether / IP / TCP 192.168.100.7:56288 > 52.178.17.234:https FA
2024-06-03 23:37:35 - Se detectó escaneo de puertos desde 192.168.100.7 | Packet Info: Ether / IP / TCP 192.168.100.7:56289 > 52.20.22.182:https A
2024-06-03 23:37:35 - Se detectó escaneo de puertos desde 192.168.100.7 | Packet Info: Ether / IP / TCP 192.168.100.7:56289 > 52.20.22.182:https PA / Raw
2024-06-03 23:37:35 - Se detectó escaneo de puertos desde 192.168.100.7 | Packet Info: Ether / IP / TCP 192.168.100.7:56289 > 52.20.22.182:https PA / Raw
2024-06-03 23:37:35 - Se detectó escaneo de puertos desde 192.168.100.7 | Packet Info: Ether / IP / TCP 192.168.100.7:56289 > 52.20.22.182:https PA / Raw
2024-06-03 23:37:35 - Se detectó escaneo de puertos desde 192.168.100.7 | Packet Info: Ether / IP / TCP 192.168.100.7:56289 > 52.20.22.182:https PA / Raw
2024-06-03 23:37:35 - Se detectó escaneo de puertos desde 52.20.22.182 | Packet Info: Ether / IP / TCP 52.20.22.182:https > 192.168.100.7:56289 A / Padding
2024-06-03 23:37:35 - Se detectó escaneo de puertos desde 192.168.100.7 | Packet Info: Ether / IP / TCP 192.168.100.7:56289 > 52.20.22.182:https A
2024-06-03 23:37:35 - Se detectó escaneo de puertos desde 192.168.100.7 | Packet Info: Ether / IP / TCP 192.168.100.7:56289 > 52.20.22.182:https PA / Raw
2024-06-03 23:37:35 - Se detectó escaneo de puertos desde 52.20.22.182 | Packet Info: Ether / IP / TCP 52.20.22.182:https > 192.168.100.7:56289 A / Padding
2024-06-03 23:37:35 - Se detectó escaneo de puertos desde 52.20.22.182 | Packet Info: Ether / IP / TCP 52.20.22.182:https > 192.168.100.7:56289 A / Padding
2024-06-03 23:37:35 - Se detectó escaneo de puertos desde 52.178.17.234 | Packet Info: Ether / IP / TCP 52.178.17.234:https > 192.168.100.7:56288 A / Padding
2024-06-03 23:37:35 - Se detectó escaneo de puertos desde 52.20.22.182 | Packet Info: Ether / IP / TCP 52.20.22.182:https > 192.168.100.7:56289 PA / Raw
2024-06-03 23:37:35 - Se detectó escaneo de puertos desde 192.168.100.7 | Packet Info: Ether / IP / TCP 192.168.100.7:56289 > 52.20.22.182:https A
2024-06-03 23:37:35 - Se detectó escaneo de puertos desde 192.168.100.7 | Packet Info: Ether / IP / TCP 192.168.100.7:56209 > 34.200.190.20:https A
2024-06-03 23:37:35 - Se detectó escaneo de puertos desde 192.168.100.7 | Packet Info: Ether / IP / TCP 192.168.100.7:56209 > 34.200.190.20:https PA / Raw
2024-06-03 23:37:35 - Se detectó escaneo de puertos desde 192.168.100.7 | Packet Info: Ether / IP / TCP 192.168.100.7:56209 > 34.200.190.20:https A
2024-06-03 23:37:35 - Se detectó escaneo de puertos desde 192.168.100.7 | Packet Info: Ether / IP / TCP 192.168.100.7:56209 > 34.200.190.20:https FA
2024-06-03 23:37:36 - Se detectó escaneo de puertos desde 192.168.100.7 | Packet Info: Ether / IP / TCP 192.168.100.7:56231 > 20.189.173.6:https PA / Raw
2024-06-03 23:37:36 - Se detectó escaneo de puertos desde 192.168.100.7 | Packet Info: Ether / IP / TCP 192.168.100.7:56231 > 20.189.173.6:https PA / Raw
2024-06-03 23:37:36 - Se detectó escaneo de puertos desde 192.168.100.7 | Packet Info: Ether / IP / TCP 192.168.100.7:56231 > 20.189.173.6:https PA / Raw
2024-06-03 23:37:36 - Se detectó escaneo de puertos desde 192.168.100.7 | Packet Info: Ether / IP / TCP 192.168.100.7:56231 > 20.189.173.6:https A
2024-06-03 23:37:36 - Se detectó escaneo de puertos desde 192.168.100.7 | Packet Info: Ether / IP / TCP 192.168.100.7:56231 > 20.189.173.6:https PA / Raw
2024-06-03 23:37:38 - Se detectó escaneo de puertos desde 192.168.100.7 | Packet Info: Ether / IP / TCP 192.168.100.7:56231 > 20.189.173.6:https PA / Raw
2024-06-03 23:37:38 - Se detectó escaneo de puertos desde 192.168.100.7 | Packet Info: Ether / IP / TCP 192.168.100.7:56231 > 20.189.173.6:https PA / Raw
2024-06-03 23:37:38 - Se detectó escaneo de puertos desde 20.189.173.6 | Packet Info: Ether / IP / TCP 20.189.173.6:https > 192.168.100.7:56231 A / Padding
2024-06-03 23:37:39 - Se detectó escaneo de puertos desde 20.189.173.6 | Packet Info: Ether / IP / TCP 20.189.173.6:https > 192.168.100.7:56231 A / Padding
2024-06-03 23:37:39 - Se detectó escaneo de puertos desde 20.189.173.6 | Packet Info: Ether / IP / TCP 20.189.173.6:https > 192.168.100.7:56231 A / Padding
2024-06-03 23:37:39 - Se detectó escaneo de puertos desde 20.189.173.6 | Packet Info: Ether / IP / TCP 20.189.173.6:https > 192.168.100.7:56231 A / Padding
2024-06-03 23:37:39 - Se detectó escaneo de puertos desde 20.189.173.6 | Packet Info: Ether / IP / TCP 20.189.173.6:https > 192.168.100.7:56231 PA / Raw
2024-06-03 23:37:39 - Se detectó escaneo de puertos desde 192.168.100.7 | Packet Info: Ether / IP / TCP 192.168.100.7:56231 > 20.189.173.6:https A
2024-06-03 23:37:40 - Se detectó escaneo de puertos desde 192.168.100.7 | Packet Info: Ether / IP / TCP 192.168.100.7:56290 > 52.178.17.234:https S
2024-06-03 23:37:40 - Se detectó escaneo de puertos desde 52.178.17.234 | Packet Info: Ether / IP / TCP 52.178.17.234:https > 192.168.100.7:56290 SA
2024-06-03 23:37:40 - Se detectó escaneo de puertos desde 192.168.100.7 | Packet Info: Ether / IP / TCP 192.168.100.7:56290 > 52.178.17.234:https A
2024-06-03 23:37:40 - Se detectó escaneo de puertos desde 192.168.100.7 | Packet Info: Ether / IP / TCP 192.168.100.7:56290 > 52.178.17.234:https PA / Raw
2024-06-03 23:37:40 - Se detectó escaneo de puertos desde 52.178.17.234 | Packet Info: Ether / IP / TCP 52.178.17.234:https > 192.168.100.7:56290 PA / Raw
2024-06-03 23:37:40 - Se detectó escaneo de puertos desde 192.168.100.7 | Packet Info: Ether / IP / TCP 192.168.100.7:56290 > 52.178.17.234:https PA / Raw
2024-06-03 23:37:40 - Se detectó escaneo de puertos desde 52.178.17.234 | Packet Info: Ether / IP / TCP 52.178.17.234:https > 192.168.100.7:56290 A / Raw
2024-06-03 23:37:40 - Se detectó escaneo de puertos desde 52.178.17.234 | Packet Info: Ether / IP / TCP 52.178.17.234:https > 192.168.100.7:56290 A / Raw
2024-06-03 23:37:40 - Se detectó escaneo de puertos desde 52.178.17.234 | Packet Info: Ether / IP / TCP 52.178.17.234:https > 192.168.100.7:56290 A / Raw
2024-06-03 23:37:40 - Se detectó escaneo de puertos desde 52.178.17.234 | Packet Info: Ether / IP / TCP 52.178.17.234:https > 192.168.100.7:56290 PA / Raw
2024-06-03 23:37:40 - Se detectó escaneo de puertos desde 192.168.100.7 | Packet Info: Ether / IP / TCP 192.168.100.7:56290 > 52.178.17.234:https A
2024-06-03 23:37:40 - Se detectó escaneo de puertos desde 192.168.100.7 | Packet Info: Ether / IP / TCP 192.168.100.7:56290 > 52.178.17.234:https PA / Raw
2024-06-03 23:37:40 - Se detectó escaneo de puertos desde 52.178.17.234 | Packet Info: Ether / IP / TCP 52.178.17.234:https > 192.168.100.7:56290 A / Padding
2024-06-03 23:37:41 - Se detectó escaneo de puertos desde 52.178.17.234 | Packet Info: Ether / IP / TCP 52.178.17.234:https > 192.168.100.7:56290 PA / Raw
2024-06-03 23:37:41 - Se detectó escaneo de puertos desde 52.178.17.234 | Packet Info: Ether / IP / TCP 52.178.17.234:https > 192.168.100.7:56290 FPA / Raw
2024-06-03 23:37:41 - Se detectó escaneo de puertos desde 192.168.100.7 | Packet Info: Ether / IP / TCP 192.168.100.7:56290 > 52.178.17.234:https A
2024-06-03 23:37:41 - Se detectó escaneo de puertos desde 192.168.100.7 | Packet Info: Ether / IP / TCP 192.168.100.7:56290 > 52.178.17.234:https PA / Raw
2024-06-03 23:37:41 - Se detectó escaneo de puertos desde 192.168.100.7 | Packet Info: Ether / IP / TCP 192.168.100.7:56290 > 52.178.17.234:https FA
2024-06-03 23:37:41 - Se detectó escaneo de puertos desde 52.178.17.234 | Packet Info: Ether / IP / TCP 52.178.17.234:https > 192.168.100.7:56290 A / Padding
2024-06-03 23:37:41 - Se detectó escaneo de puertos desde 192.168.100.7 | Packet Info: Ether / IP / TCP 192.168.100.7:55829 > 162.159.136.234:https A
2024-06-03 23:37:41 - Se detectó escaneo de puertos desde 192.168.100.7 | Packet Info: Ether / IP / TCP 192.168.100.7:56208 > 51.116.253.169:https PA / Raw
2024-06-03 23:37:41 - Se detectó escaneo de puertos desde 192.168.100.7 | Packet Info: Ether / IP / TCP 192.168.100.7:56208 > 51.116.253.169:https PA / Raw
2024-06-03 23:37:41 - Se detectó escaneo de puertos desde 192.168.100.7 | Packet Info: Ether / IP / TCP 192.168.100.7:56208 > 51.116.253.169:https PA / Raw
2024-06-03 23:37:41 - Se detectó escaneo de puertos desde 192.168.100.7 | Packet Info: Ether / IP / TCP 192.168.100.7:56208 > 51.116.253.169:https A
2024-06-03 23:37:41 - Se detectó escaneo de puertos desde 192.168.100.7 | Packet Info: Ether / IP / TCP 192.168.100.7:56208 > 51.116.253.169:https PA / Raw
2024-06-03 23:37:42 - Se detectó escaneo de puertos desde 192.168.100.7 | Packet Info: Ether / IP / TCP 192.168.100.7:55829 > 162.159.136.234:https A
2024-06-03 23:37:42 - Se detectó escaneo de puertos desde 192.168.100.7 | Packet Info: Ether / IP / TCP 192.168.100.7:49677 > 207.188.7.33:https A / Raw
2024-06-03 23:37:43 - Se detectó escaneo de puertos desde 192.168.100.7 | Packet Info: Ether / IP / TCP 192.168.100.7:56252 > 13.107.6.175:https A / Raw
2024-06-03 23:37:43 - Se detectó escaneo de puertos desde 192.168.100.7 | Packet Info: Ether / IP / TCP 192.168.100.7:56249 > 13.107.6.175:https A / Raw
2024-06-03 23:37:44 - Se detectó escaneo de puertos desde 192.168.100.7 | Packet Info: Ether / IP / TCP 192.168.100.7:55138 > 157.90.91.75:https A / Raw
2024-06-03 23:37:46 - Se detectó escaneo de puertos desde 192.168.100.7 | Packet Info: Ether / IP / TCP 192.168.100.7:49768 > 35.186.224.36:https PA / Raw
2024-06-03 23:37:46 - Se detectó escaneo de puertos desde 192.168.100.7 | Packet Info: Ether / IP / TCP 192.168.100.7:49768 > 35.186.224.36:https A
2024-06-03 23:37:46 - Se detectó escaneo de puertos desde 192.168.100.7 | Packet Info: Ether / IP / TCP 192.168.100.7:56208 > 51.116.253.169:https PA / Raw
2024-06-03 23:37:47 - Se detectó escaneo de puertos desde 192.168.100.7 | Packet Info: Ether / IP / TCP 192.168.100.7:56208 > 51.116.253.169:https PA / Raw
2024-06-03 23:37:47 - Se detectó escaneo de puertos desde 192.168.100.7 | Packet Info: Ether / IP / TCP 192.168.100.7:56208 > 51.116.253.169:https PA / Raw
2024-06-04 00:09:01 - Configuración actualizada.
2024-06-04 00:20:01 - Iniciando captura de paquetes...
2024-06-04 00:20:14 - Se detectó escaneo de puertos desde 192.168.100.7 | Packet Info: Ether / IP / TCP 192.168.100.7:55138 > 157.90.91.75:https A
2024-06-04 00:25:11 - Usuario autenticado - IP: 192.168.100.7, IPv6: 2806:2f0:5500:f195:b960:cfe2:1a1d:676, MAC: 0A-00-27-00-00-0E
2024-06-04 00:29:50 - Iniciando captura de paquetes...
2024-06-04 00:30:02 - Se detectó escaneo de puertos desde 192.168.100.7 | Packet Info: Ether / IP / TCP 192.168.100.7:57054 > 20.50.80.213:https PA / Raw
2024-06-04 00:30:02 - Se detectó escaneo de puertos desde 192.168.100.7 | Packet Info: Ether / IP / TCP 192.168.100.7:57054 > 20.50.80.213:https A
2024-06-04 00:30:02 - Se detectó escaneo de puertos desde 192.168.100.7 | Packet Info: Ether / IP / TCP 192.168.100.7:57054 > 20.50.80.213:https PA / Raw
2024-06-04 00:30:03 - Se detectó escaneo de puertos desde 192.168.100.7 | Packet Info: Ether / IP / TCP 192.168.100.7:57054 > 20.50.80.213:https PA / Raw
2024-06-04 00:30:04 - Se detectó escaneo de puertos desde 192.168.100.7 | Packet Info: Ether / IP / TCP 192.168.100.7:57054 > 20.50.80.213:https PA / Raw
2024-06-04 00:30:04 - Se detectó escaneo de puertos desde 192.168.100.7 | Packet Info: Ether / IP / TCP 192.168.100.7:57054 > 20.50.80.213:https A
2024-06-04 00:30:05 - Se detectó escaneo de puertos desde 192.168.100.7 | Packet Info: Ether / IP / TCP 192.168.100.7:57077 > 162.159.130.234:https A
2024-06-04 00:30:06 - Se detectó escaneo de puertos desde 192.168.100.7 | Packet Info: Ether / IP / TCP 192.168.100.7:49677 > 207.188.7.33:https A / Raw
2024-06-04 09:44:01 - Usuario autenticado - IP: 192.168.100.7, IPv6: 2806:2f0:5500:f195:b960:cfe2:1a1d:676, MAC: 0A-00-27-00-00-0E
2024-06-04 09:50:16 - Usuario autenticado - IP: 192.168.100.7, IPv6: 2806:2f0:5500:f195:b960:cfe2:1a1d:676, MAC: 0A-00-27-00-00-0E
2024-06-04 09:50:38 - Iniciando captura de paquetes...
2024-06-04 09:50:39 - Se detectó escaneo de puertos desde 206.247.29.53 | Packet Info: Ether / IP / TCP 206.247.29.53:https > 192.168.100.7:50344 PA / Raw
2024-06-04 09:50:39 - Se detectó escaneo de puertos desde 206.247.29.53 | Packet Info: Ether / IP / TCP 206.247.29.53:https > 192.168.100.7:50344 PA / Raw
2024-06-04 09:50:39 - Se detectó escaneo de puertos desde 192.168.100.7 | Packet Info: Ether / IP / TCP 192.168.100.7:50344 > 206.247.29.53:https PA / Raw
2024-06-04 09:50:39 - Se detectó escaneo de puertos desde 206.247.29.53 | Packet Info: Ether / IP / TCP 206.247.29.53:https > 192.168.100.7:50344 A / Padding
2024-06-04 09:50:39 - Se detectó escaneo de puertos desde 206.247.29.53 | Packet Info: Ether / IP / TCP 206.247.29.53:https > 192.168.100.7:50343 PA / Raw
2024-06-04 09:50:39 - Se detectó escaneo de puertos desde 192.168.100.7 | Packet Info: Ether / IP / TCP 192.168.100.7:50343 > 206.247.29.53:https PA / Raw
2024-06-04 09:50:39 - Se detectó escaneo de puertos desde 206.247.29.53 | Packet Info: Ether / IP / TCP 206.247.29.53:https > 192.168.100.7:50343 A / Padding
2024-06-04 09:50:39 - Se detectó escaneo de puertos desde 206.247.29.53 | Packet Info: Ether / IP / TCP 206.247.29.53:https > 192.168.100.7:50343 PA / Raw
2024-06-04 09:50:39 - Se detectó escaneo de puertos desde 192.168.100.7 | Packet Info: Ether / IP / TCP 192.168.100.7:50343 > 206.247.29.53:https PA / Raw
2024-06-04 09:50:39 - Se detectó escaneo de puertos desde 206.247.29.53 | Packet Info: Ether / IP / TCP 206.247.29.53:https > 192.168.100.7:50343 A / Padding
2024-06-04 09:50:39 - Se detectó escaneo de puertos desde 192.168.100.7 | Packet Info: Ether / IP / TCP 192.168.100.7:50343 > 206.247.29.53:https PA / Raw
2024-06-04 09:50:39 - Se detectó escaneo de puertos desde 192.168.100.7 | Packet Info: Ether / IP / TCP 192.168.100.7:50343 > 206.247.29.53:https PA / Raw
2024-06-04 09:50:39 - Se detectó escaneo de puertos desde 206.247.29.53 | Packet Info: Ether / IP / TCP 206.247.29.53:https > 192.168.100.7:50343 A / Padding
2024-06-04 09:50:39 - Se detectó escaneo de puertos desde 206.247.29.53 | Packet Info: Ether / IP / TCP 206.247.29.53:https > 192.168.100.7:50343 A / Padding
2024-06-04 09:50:39 - Se detectó escaneo de puertos desde 206.247.29.53 | Packet Info: Ether / IP / TCP 206.247.29.53:https > 192.168.100.7:50343 PA / Raw
2024-06-04 09:50:39 - Se detectó escaneo de puertos desde 192.168.100.7 | Packet Info: Ether / IP / TCP 192.168.100.7:50343 > 206.247.29.53:https A
2024-06-04 09:50:40 - Se detectó escaneo de puertos desde 206.247.29.53 | Packet Info: Ether / IP / TCP 206.247.29.53:https > 192.168.100.7:50343 PA / Raw
2024-06-04 09:50:40 - Se detectó escaneo de puertos desde 192.168.100.7 | Packet Info: Ether / IP / TCP 192.168.100.7:50343 > 206.247.29.53:https PA / Raw
2024-06-04 09:50:40 - Se detectó escaneo de puertos desde 206.247.29.53 | Packet Info: Ether / IP / TCP 206.247.29.53:https > 192.168.100.7:50343 A / Padding
2024-06-04 09:50:40 - Se detectó escaneo de puertos desde 192.168.100.7 | Packet Info: Ether / IP / TCP 192.168.100.7:50343 > 206.247.29.53:https PA / Raw
2024-06-04 09:50:40 - Se detectó escaneo de puertos desde 206.247.29.53 | Packet Info: Ether / IP / TCP 206.247.29.53:https > 192.168.100.7:50343 A / Padding
2024-06-04 09:50:40 - Se detectó escaneo de puertos desde 206.247.29.53 | Packet Info: Ether / IP / TCP 206.247.29.53:https > 192.168.100.7:50343 PA / Raw
2024-06-04 09:50:40 - Se detectó escaneo de puertos desde 192.168.100.7 | Packet Info: Ether / IP / TCP 192.168.100.7:50343 > 206.247.29.53:https PA / Raw
2024-06-04 09:50:41 - Se detectó escaneo de puertos desde 206.247.29.53 | Packet Info: Ether / IP / TCP 206.247.29.53:https > 192.168.100.7:50343 A / Padding
2024-06-04 09:50:41 - Se detectó escaneo de puertos desde 206.247.29.53 | Packet Info: Ether / IP / TCP 206.247.29.53:https > 192.168.100.7:50343 PA / Raw
2024-06-04 09:50:41 - Se detectó escaneo de puertos desde 192.168.100.7 | Packet Info: Ether / IP / TCP 192.168.100.7:50343 > 206.247.29.53:https PA / Raw
2024-06-04 09:50:41 - Se detectó escaneo de puertos desde 206.247.29.53 | Packet Info: Ether / IP / TCP 206.247.29.53:https > 192.168.100.7:50343 PA / Raw
2024-06-04 09:50:41 - Se detectó escaneo de puertos desde 192.168.100.7 | Packet Info: Ether / IP / TCP 192.168.100.7:50343 > 206.247.29.53:https PA / Raw
2024-06-04 09:50:41 - Se detectó escaneo de puertos desde 206.247.29.53 | Packet Info: Ether / IP / TCP 206.247.29.53:https > 192.168.100.7:50343 A / Padding
2024-06-04 09:50:41 - Se detectó escaneo de puertos desde 206.247.29.53 | Packet Info: Ether / IP / TCP 206.247.29.53:https > 192.168.100.7:50343 A / Padding
2024-06-04 09:50:41 - Se detectó escaneo de puertos desde 206.247.29.53 | Packet Info: Ether / IP / TCP 206.247.29.53:https > 192.168.100.7:50343 PA / Raw
2024-06-04 09:50:41 - Se detectó escaneo de puertos desde 192.168.100.7 | Packet Info: Ether / IP / TCP 192.168.100.7:50343 > 206.247.29.53:https PA / Raw
2024-06-04 09:50:41 - Se detectó escaneo de puertos desde 206.247.29.53 | Packet Info: Ether / IP / TCP 206.247.29.53:https > 192.168.100.7:50343 A / Padding
2024-06-04 09:50:42 - Se detectó escaneo de puertos desde 192.168.100.7 | Packet Info: Ether / IP / TCP 192.168.100.7:50343 > 206.247.29.53:https PA / Raw
2024-06-04 09:50:42 - Se detectó escaneo de puertos desde 192.168.100.7 | Packet Info: Ether / IP / TCP 192.168.100.7:50099 > 20.127.250.238:https PA / Raw
2024-06-04 09:50:42 - Se detectó escaneo de puertos desde 206.247.29.53 | Packet Info: Ether / IP / TCP 206.247.29.53:https > 192.168.100.7:50343 A / Padding
2024-06-04 09:50:42 - Se detectó escaneo de puertos desde 206.247.29.53 | Packet Info: Ether / IP / TCP 206.247.29.53:https > 192.168.100.7:50343 PA / Raw
2024-06-04 09:50:42 - Se detectó escaneo de puertos desde 206.247.29.53 | Packet Info: Ether / IP / TCP 206.247.29.53:https > 192.168.100.7:50343 PA / Raw
2024-06-04 09:50:42 - Se detectó escaneo de puertos desde 192.168.100.7 | Packet Info: Ether / IP / TCP 192.168.100.7:50343 > 206.247.29.53:https A
2024-06-04 09:50:42 - Se detectó escaneo de puertos desde 192.168.100.7 | Packet Info: Ether / IP / TCP 192.168.100.7:50343 > 206.247.29.53:https PA / Raw
2024-06-04 09:50:42 - Se detectó escaneo de puertos desde 206.247.29.53 | Packet Info: Ether / IP / TCP 206.247.29.53:https > 192.168.100.7:50343 A / Padding
2024-06-04 09:50:42 - Se detectó escaneo de puertos desde 192.168.100.7 | Packet Info: Ether / IP / TCP 192.168.100.7:50344 > 206.247.29.53:https PA / Raw
2024-06-04 09:50:42 - Se detectó escaneo de puertos desde 206.247.29.53 | Packet Info: Ether / IP / TCP 206.247.29.53:https > 192.168.100.7:50344 A / Padding
2024-06-04 09:50:42 - Se detectó escaneo de puertos desde 206.247.29.53 | Packet Info: Ether / IP / TCP 206.247.29.53:https > 192.168.100.7:50344 PA / Raw
2024-06-04 09:50:42 - Se detectó escaneo de puertos desde 206.247.29.53 | Packet Info: Ether / IP / TCP 206.247.29.53:https > 192.168.100.7:50344 PA / Raw
2024-06-04 09:50:42 - Se detectó escaneo de puertos desde 192.168.100.7 | Packet Info: Ether / IP / TCP 192.168.100.7:50344 > 206.247.29.53:https A
2024-06-04 09:50:42 - Se detectó escaneo de puertos desde 192.168.100.7 | Packet Info: Ether / IP / TCP 192.168.100.7:50344 > 206.247.29.53:https PA / Raw
2024-06-04 09:50:43 - Se detectó escaneo de puertos desde 206.247.29.53 | Packet Info: Ether / IP / TCP 206.247.29.53:https > 192.168.100.7:50344 A / Padding
2024-06-04 09:50:44 - Se detectó escaneo de puertos desde 206.247.29.53 | Packet Info: Ether / IP / TCP 206.247.29.53:https > 192.168.100.7:50343 PA / Raw
2024-06-04 09:50:44 - Se detectó escaneo de puertos desde 192.168.100.7 | Packet Info: Ether / IP / TCP 192.168.100.7:50343 > 206.247.29.53:https PA / Raw
2024-06-04 09:50:44 - Se detectó escaneo de puertos desde 206.247.29.53 | Packet Info: Ether / IP / TCP 206.247.29.53:https > 192.168.100.7:50343 A / Padding
2024-06-04 09:50:44 - Se detectó escaneo de puertos desde 206.247.29.53 | Packet Info: Ether / IP / TCP 206.247.29.53:https > 192.168.100.7:50343 PA / Raw
2024-06-04 09:50:44 - Se detectó escaneo de puertos desde 192.168.100.7 | Packet Info: Ether / IP / TCP 192.168.100.7:50343 > 206.247.29.53:https PA / Raw
2024-06-04 09:50:44 - Se detectó escaneo de puertos desde 206.247.29.53 | Packet Info: Ether / IP / TCP 206.247.29.53:https > 192.168.100.7:50343 A / Padding
2024-06-04 09:50:44 - Se detectó escaneo de puertos desde 206.247.29.53 | Packet Info: Ether / IP / TCP 206.247.29.53:https > 192.168.100.7:50343 PA / Raw
2024-06-04 09:50:44 - Se detectó escaneo de puertos desde 192.168.100.7 | Packet Info: Ether / IP / TCP 192.168.100.7:50343 > 206.247.29.53:https PA / Raw
2024-06-04 09:50:44 - Se detectó escaneo de puertos desde 206.247.29.53 | Packet Info: Ether / IP / TCP 206.247.29.53:https > 192.168.100.7:50343 A / Padding
2024-06-04 09:50:45 - Se detectó escaneo de puertos desde 192.168.100.7 | Packet Info: Ether / IP / TCP 192.168.100.7:51353 > 13.69.239.74:https A / Raw
2024-06-04 09:50:45 - Se detectó escaneo de puertos desde 206.247.29.53 | Packet Info: Ether / IP / TCP 206.247.29.53:https > 192.168.100.7:50343 PA / Raw
2024-06-04 09:50:45 - Se detectó escaneo de puertos desde 192.168.100.7 | Packet Info: Ether / IP / TCP 192.168.100.7:50343 > 206.247.29.53:https PA / Raw
2024-06-04 09:50:45 - Se detectó escaneo de puertos desde 206.247.29.53 | Packet Info: Ether / IP / TCP 206.247.29.53:https > 192.168.100.7:50343 A / Padding
2024-06-04 09:50:46 - Se detectó escaneo de puertos desde 192.168.100.7 | Packet Info: Ether / IP / TCP 192.168.100.7:50343 > 206.247.29.53:https PA / Raw
2024-06-04 09:50:46 - Se detectó escaneo de puertos desde 206.247.29.53 | Packet Info: Ether / IP / TCP 206.247.29.53:https > 192.168.100.7:50343 A / Padding
2024-06-04 09:50:46 - Se detectó escaneo de puertos desde 206.247.29.53 | Packet Info: Ether / IP / TCP 206.247.29.53:https > 192.168.100.7:50343 PA / Raw
2024-06-04 09:50:46 - Se detectó escaneo de puertos desde 206.247.29.53 | Packet Info: Ether / IP / TCP 206.247.29.53:https > 192.168.100.7:50343 PA / Raw
2024-06-04 09:50:46 - Se detectó escaneo de puertos desde 192.168.100.7 | Packet Info: Ether / IP / TCP 192.168.100.7:50343 > 206.247.29.53:https A
2024-06-04 09:50:46 - Se detectó escaneo de puertos desde 192.168.100.7 | Packet Info: Ether / IP / TCP 192.168.100.7:50343 > 206.247.29.53:https PA / Raw
2024-06-04 09:50:46 - Se detectó escaneo de puertos desde 206.247.29.53 | Packet Info: Ether / IP / TCP 206.247.29.53:https > 192.168.100.7:50343 A / Padding
2024-06-04 09:50:46 - Se detectó escaneo de puertos desde 192.168.100.7 | Packet Info: Ether / IP / TCP 192.168.100.7:50344 > 206.247.29.53:https PA / Raw
2024-06-04 09:50:46 - Se detectó escaneo de puertos desde 206.247.29.53 | Packet Info: Ether / IP / TCP 206.247.29.53:https > 192.168.100.7:50344 A / Padding
2024-06-04 09:50:46 - Se detectó escaneo de puertos desde 206.247.29.53 | Packet Info: Ether / IP / TCP 206.247.29.53:https > 192.168.100.7:50344 PA / Raw
2024-06-04 09:50:46 - Se detectó escaneo de puertos desde 206.247.29.53 | Packet Info: Ether / IP / TCP 206.247.29.53:https > 192.168.100.7:50344 PA / Raw
2024-06-04 09:50:46 - Se detectó escaneo de puertos desde 192.168.100.7 | Packet Info: Ether / IP / TCP 192.168.100.7:50344 > 206.247.29.53:https A
2024-06-04 09:50:46 - Se detectó escaneo de puertos desde 192.168.100.7 | Packet Info: Ether / IP / TCP 192.168.100.7:50344 > 206.247.29.53:https PA / Raw
2024-06-04 09:50:46 - Se detectó escaneo de puertos desde 206.247.29.53 | Packet Info: Ether / IP / TCP 206.247.29.53:https > 192.168.100.7:50344 A / Padding
2024-06-04 09:50:47 - Se detectó escaneo de puertos desde 192.168.100.7 | Packet Info: Ether / IP / TCP 192.168.100.7:50343 > 206.247.29.53:https PA / Raw
2024-06-04 09:50:47 - Se detectó escaneo de puertos desde 206.247.29.53 | Packet Info: Ether / IP / TCP 206.247.29.53:https > 192.168.100.7:50343 A / Padding
2024-06-04 09:50:47 - Se detectó escaneo de puertos desde 206.247.29.53 | Packet Info: Ether / IP / TCP 206.247.29.53:https > 192.168.100.7:50343 PA / Raw
2024-06-04 09:50:47 - Se detectó escaneo de puertos desde 192.168.100.7 | Packet Info: Ether / IP / TCP 192.168.100.7:50343 > 206.247.29.53:https A
2024-06-04 09:50:47 - Se detectó escaneo de puertos desde 192.168.100.7 | Packet Info: Ether / IP / TCP 192.168.100.7:51354 > 18.160.124.69:https A / Raw
2024-06-04 09:50:48 - Se detectó escaneo de puertos desde 206.247.29.53 | Packet Info: Ether / IP / TCP 206.247.29.53:https > 192.168.100.7:50343 PA / Raw
2024-06-04 09:50:48 - Se detectó escaneo de puertos desde 192.168.100.7 | Packet Info: Ether / IP / TCP 192.168.100.7:50343 > 206.247.29.53:https PA / Raw
2024-06-04 09:50:48 - Se detectó escaneo de puertos desde 206.247.29.53 | Packet Info: Ether / IP / TCP 206.247.29.53:https > 192.168.100.7:50343 A / Padding
2024-06-04 09:50:48 - Se detectó escaneo de puertos desde 206.247.29.53 | Packet Info: Ether / IP / TCP 206.247.29.53:https > 192.168.100.7:50343 PA / Raw
2024-06-04 09:50:48 - Se detectó escaneo de puertos desde 192.168.100.7 | Packet Info: Ether / IP / TCP 192.168.100.7:50343 > 206.247.29.53:https PA / Raw
2024-06-04 09:50:48 - Se detectó escaneo de puertos desde 206.247.29.53 | Packet Info: Ether / IP / TCP 206.247.29.53:https > 192.168.100.7:50343 A / Padding
2024-06-04 09:50:48 - Se detectó escaneo de puertos desde 192.168.100.7 | Packet Info: Ether / IP / TCP 192.168.100.7:49683 > 212.102.40.165:https A / Raw
